Claim Number,Claim Feature,Policy Number,Policy Effective Date,Loss Description,Type of injury,Loss state,Loss Date,Insured Company Name,Paid Indemnity,Paid DCC,Outstanding Indemnity,Outstanding DCC,Adjuster Notes,,,,,,,,,,,,,,,,,,,,,,,,,,
GL-2023-0102,Scaffolding Collapse,POL-GL-567890,2023-01-01,Scaffolding failure at renovation site,Bodily Injury/Property Damage,CA,2023-02-28,Pacific Coast Contractors Inc,195000,55000,0,0,"02/28/2023 - Catastrophic scaffold collapse during high winds. Three workers injured, multiple vehicles damaged below. | 03/01/2023 - Cal/OSHA on site immediately. Preliminary finding: scaffolding not properly secured to building, missing required cross-bracing. | 03/03/2023 - Injured workers: Jose Martinez (fractured pelvis), Mike Chen (concussion and lacerations), Roberto Silva (broken ribs and internal injuries). | 03/10/2023 - Property damage assessment: Four vehicles totaled, one storefront window shattered. Total property damage $65K. | 03/15/2023 - Workers' comp carriers pursuing subrogation. Our insured was general contractor with safety oversight responsibility. | 03/25/2023 - Legal representation engaged: Martinez retained Panish Shea Boyle Ravipudi LLP. Anticipating significant demand given permanent impairment. | 04/10/2023 - OSHA citations issued: $45K in fines for willful violations. Criminal investigation referral possible. | 04/25/2023 - Settlement conference held. Global resolution reached: Martinez $125K, Chen $35K, Silva $35K. Property damage claims settled separately. | 05/15/2023 - All releases obtained. Insured required to implement comprehensive scaffold safety program with third-party oversight.",,,,,,,,,,,,,,,,,,,,,,,,,,
GL-2023-0103,Restaurant Kitchen Fire,POL-GL-789012,2022-06-01,Grease fire spread to adjacent businesses,Property Damage,TX,2023-03-15,Lone Star BBQ House,275000,45000,0,0,"03/15/2023 - Major grease fire in kitchen exhaust system. Spread through shared ventilation to adjacent retail spaces. | 03/16/2023 - Fire Marshal investigation: Exhaust hood cleaning records falsified. System hadn't been properly cleaned in 18 months. Grease buildup excessive. | 03/18/2023 - Adjacent businesses affected: Boutique clothing store (smoke damage to entire inventory), law office (smoke and water damage to files and electronics). | 03/25/2023 - Initial damage estimates: Clothing store $125K inventory loss plus $40K cleaning. Law office $85K equipment and $50K document restoration. | 04/01/2023 - Coverage analysis complete. CGL responds to property damage to others. Fire legal liability sublimit adequate at $500K. | 04/10/2023 - Clothing store attorney: Demanding $200K including two weeks lost business. Law office claiming additional $75K for business interruption. | 04/20/2023 - Negotiations with both claimants. Strong liability given maintenance negligence and code violations. | 05/01/2023 - Settlements reached: Clothing store $165K all inclusive. Law office $110K including BI claims. | 05/20/2023 - Subrogation potential against hood cleaning contractor being evaluated. Final payments issued.",,,,,,,,,,,,,,,,,,,,,,,,,,
GL-2023-0104,Parking Garage Assault,POL-GL-234567,2023-02-01,Customer assaulted due to inadequate security,Bodily Injury,IL,2023-04-22,City Center Parking LLC,145000,38000,0,0,"04/22/2023 - Brutal assault in parking garage. Victim Sarah Thompson attacked and robbed while walking to car at 8 PM. | 04/23/2023 - Police report obtained. This is fourth similar incident in six months. No security guards on duty despite previous incidents. | 04/25/2023 - Victim injuries severe: Facial fractures, traumatic brain injury, PTSD. Attacker still at large. | 05/01/2023 - Prior incidents reviewed. Management received multiple complaints about lighting and security but took no action. Clear notice of dangerous condition. | 05/10/2023 - Victim representation: Clifford Law Offices. Alleging negligent security and seeking seven figures given TBI and ongoing cognitive issues. | 05/20/2023 - Crime statistics obtained for area. Expert opinion that security measures fell below industry standard for high-crime location. | 06/01/2023 - Medical costs mounting: $95K to date with extensive future treatment needed. Neuropsychological testing shows permanent impairment. | 06/15/2023 - Settlement demand: $500K. Given clear liability and sympathetic plaintiff, recommendation to settle within policy limits. | 07/01/2023 - Settled for $145K plus commitment to implement comprehensive security program including guards, cameras, and improved lighting.",,,,,,,,,,,,,,,,,,,,,,,,,,
GL-2023-0105,Bounce House Wind,POL-GL-456789,2022-12-01,Inflatable lifted by wind with children inside,Bodily Injury,AZ,2023-05-10,Desert Party Rentals LLC,225000,48000,0,0,"05/10/2023 - Tragic bounce house incident at birthday party. Dust devil lifted inflatable 20 feet with three children inside. | 05/11/2023 - Initial assessment: Two children thrown from bounce house during lift, one rode it down. Ages 5, 7, and 8. | 05/12/2023 - Injuries documented: 5-year-old (skull fracture, in pediatric ICU), 7-year-old (broken femur and arm), 8-year-old (miraculously only bruises and psychological trauma). | 05/15/2023 - Weather service confirmed dust devil conditions common in area during May. Operator had no weather monitoring protocol. | 05/20/2023 - Anchoring system inspection: Only 4 stakes used instead of required 8. Stakes were wrong type for desert soil conditions. | 05/25/2023 - Legal representation: 5-year-old family retained Husch Blackwell. Other families also seeking counsel. Anticipating coordinated litigation. | 06/05/2023 - Medical update: 5-year-old showing cognitive deficits. May need special education services. Future medical costs estimated at $200K+. | 06/20/2023 - Insurance coverage confirmed but aggregate limits concern given severity. Excess carrier placed on notice. | 07/10/2023 - Global settlement negotiated: $125K to 5-year-old, $75K to 7-year-old, $25K to 8-year-old. Structured settlement for youngest child.",,,,,,,,,,,,,,,,,,,,,,,,,,
GL-2023-0106,Cybersecurity Breach,POL-GL-678901,2023-03-01,Customer data breach led to identity theft claims,Personal Injury,WA,2023-06-15,TechSecure Solutions Inc,165000,52000,135000,28000,"06/15/2023 - Major data breach discovered affecting 50,000 customers. Personal information including SSNs and credit cards exposed. | 06/16/2023 - Forensic investigation launched with Mandiant. Initial vector appears to be unpatched vulnerability exploited by ransomware group. | 06/20/2023 - Notification letters sent to affected individuals per state breach laws. Class action anticipated given scale and sensitive data involved. | 06/25/2023 - First identity theft claims emerging. Multiple customers reporting fraudulent accounts opened, credit damage. | 07/01/2023 - Class action filed in W.D. Washington. Keller Rohrback L.L.P. as class counsel. Seeking credit monitoring and statutory damages. | 07/15/2023 - Coverage analysis: Limited cyber coverage on GL policy. $500K sublimit with $100K retention. Personal injury coverage may apply to privacy violations. | 08/01/2023 - Individual claims growing: 127 customers with documented identity theft losses. Aggregate exposure exceeding $1M. | 08/20/2023 - Partial settlement of individual claims at $165K. Class action negotiations ongoing. Regulator investigations by multiple states. | 09/01/2023 - Reserve established at $300K for remaining exposure. Insured implementing enhanced cybersecurity measures as part of settlement.",,,,,,,,,,,,,,,,,,,,,,,,,,
GL-2023-0107,Amusement Park Ride,POL-GL-890123,2022-08-01,Roller coaster malfunction caused whiplash injuries,Bodily Injury,FL,2023-07-20,Sunshine Thrills Park,198000,42000,0,0,"07/20/2023 - Roller coaster emergency stop malfunction. Ride stopped abruptly at high speed causing multiple neck and back injuries. | 07/21/2023 - Twelve riders treated on scene, eight transported to hospital. Most serious: two with herniated discs confirmed by MRI. | 07/23/2023 - State inspection revealed brake system computer error. Failsafe didn't engage properly. Maintenance records show system errors ignored. | 07/28/2023 - Legal notices received from six riders. Most serious claims from Amanda Foster (26, professional dancer) and Marcus Johnson (44, construction worker). | 08/05/2023 - Medical documentation mounting. Foster requires surgery for C5-C6 disc herniation. Career as dancer likely ended. Johnson also surgical candidate. | 08/15/2023 - Media coverage intense. Orlando Sentinel running series on park safety. Public pressure for substantial settlements. | 08/25/2023 - Foster represented by Morgan & Morgan. Initial demand $750K given lost career earnings. Johnson seeking $400K. | 09/10/2023 - Negotiated settlements: Foster $95K, Johnson $65K, remaining claims $38K combined. Avoided prolonged litigation and publicity. | 09/25/2023 - All claims resolved. Park required to implement redundant safety systems and increase inspection frequency.",,,,,,,,,,,,,,,,,,,,,,,,,,
GL-2023-0108,Construction Site Fall,POL-GL-234567,2023-01-01,Subcontractor fell through unmarked opening,Bodily Injury,NY,2023-08-05,Empire State Builders Corp,265000,58000,0,0,"08/05/2023 - Electrician fell 20 feet through unmarked floor opening at construction site. No fall protection or hole covering in place. | 08/06/2023 - Victim Anthony Ricci airlifted to trauma center. Multiple injuries including fractured vertebrae, broken pelvis, internal bleeding. | 08/08/2023 - OSHA investigation launched. Site superintendent admitted knowing about opening but hadn't gotten around to covering it. | 08/12/2023 - Labor Law 240/241 claim anticipated. Strict liability in New York for elevation-related injuries. No defense available. | 08/20/2023 - Ricci's condition stabilized but facing multiple surgeries. Spinal fusion required. Permanent partial disability likely. | 09/01/2023 - Legal representation: Block O'Toole & Murphy. Firm known for eight-figure construction accident verdicts. | 09/15/2023 - Medical costs exceeding $200K. Future care needs estimated at additional $300K. Lost wages significant - union electrician. | 10/01/2023 - Settlement negotiations intense. Plaintiff's counsel starting at $2M demand given clear liability and Labor Law claims. | 10/20/2023 - Settled for $265K (policy limits). Additional coverage from owner and other contractors. Total settlement to plaintiff $850K.",,,,,,,,,,,,,,,,,,,,,,,,,,
GL-2023-0109,Toxic Mold,POL-GL-456789,2022-10-01,Tenant illness from undisclosed mold in apartment,Bodily Injury,CA,2023-09-12,Coastal Property Management Co,175000,45000,0,0,"09/12/2023 - Tenant Maria Gonzalez hospitalized with severe respiratory issues. Toxic black mold (Stachybotrys) found throughout apartment. | 09/13/2023 - Investigation reveals extensive water damage from roof leaks hidden behind walls. Mold present for months before rental. | 09/15/2023 - Tenant's daughter (age 4) also showing respiratory symptoms. Both diagnosed with mold-induced asthma, likely permanent. | 09/20/2023 - Prior complaints discovered. Previous tenant reported musty odor and water stains. Management painted over without investigating. | 09/25/2023 - Environmental testing: Mold spore counts 50x acceptable levels. Expert declares unit uninhabitable without full remediation. | 10/01/2023 - Legal counsel retained: Gomez Trial Attorneys. Seeking damages for medical costs, relocation, and ongoing health issues. | 10/10/2023 - Medical documentation substantial. Mother and daughter require daily medications, regular pulmonologist visits. | 10/25/2023 - City building department issued citations. Multiple code violations including failure to maintain habitable conditions. | 11/15/2023 - Settlement reached at $175K covering medical costs, pain and suffering, and relocation expenses. Apartment complex sold for remediation.",,,,,,,,,,,,,,,,,,,,,,,,,,
GL-2023-0110,Delivery Truck,POL-GL-678901,2023-02-01,Delivery truck struck pedestrian in crosswalk,Bodily Injury,MA,2023-10-25,QuickShip Logistics LLC,145000,32000,0,0,"10/25/2023 - Delivery driver making right turn struck pedestrian Dr. James Liu in marked crosswalk. Driver admitted not seeing victim. | 10/26/2023 - Dr. Liu suffered fractured tibia and fibula, severe road rash, concussion. Transported to Mass General Hospital. | 10/28/2023 - Police investigation: Driver was checking delivery app while turning. Cited for failure to yield and distracted driving. | 11/01/2023 - Victim is surgeon at Boston Children's Hospital. Unable to perform surgeries for minimum 3 months. Significant wage loss. | 11/05/2023 - Dashcam footage obtained showing driver never looked right before turning. Clear negligence established. | 11/15/2023 - Attorney representation: Lubin & Meyer. Firm specializes in medical professional injuries. Demand expected to be substantial. | 11/25/2023 - Medical bills totaling $78K. Lost wages calculated at $150K for recovery period. Future impacts being assessed. | 12/10/2023 - Settlement negotiations productive. Plaintiff reasonable given clear liability. Agreed to $145K inclusive settlement. | 12/20/2023 - Claim resolved. Company implemented strict no-phone policy with tracking devices to monitor compliance.",,,,,,,,,,,,,,,,,,,,,,,,,,
GL-2023-0111,Nightclub Shooting,POL-GL-890123,2022-09-01,Inadequate security led to shooting incident,Bodily Injury,GA,2023-11-15,Atlanta Nights Entertainment,285000,78000,215000,42000,"11/15/2023 - Mass shooting at nightclub. Three patrons shot, multiple others injured in stampede. Prior violent incidents at venue. | 11/16/2023 - Investigation reveals no metal detectors despite previous weapons incidents. Only two security guards for 400-person capacity. | 11/18/2023 - Victims: DeAndre Williams (paralyzed from waist down), Keisha Johnson (shot in shoulder), Marcus Brown (grazed, trampled). | 11/22/2023 - Prior incidents documented: Four weapons arrests, two assaults in past year. Police recommended enhanced security repeatedly. | 12/01/2023 - Plaintiffs' counsel: Collectively represented by Cochran Firm. Alleging gross negligence in security measures. | 12/10/2023 - Williams facing lifetime of medical care. Initial costs $250K, future care estimated at $2M+. | 12/20/2023 - Media pressure intense. Club's history of violence featured in investigative reports. City considering license revocation. | 01/10/2024 - Partial settlements: Johnson $65K, Brown $25K. Williams claim ongoing due to catastrophic nature. | 01/25/2024 - Reserve increased to $500K total. Excess carrier involved. Negotiating structured settlement for Williams.",,,,,,,,,,,,,,,,,,,,,,,,,,
GL-2023-0112,Pool Chemical,POL-GL-234567,2023-03-01,Pool chemical mixture caused respiratory injuries,Bodily Injury,AZ,2023-12-20,Crystal Clear Pool Service,92000,21000,0,0,"12/20/2023 - Pool service tech mixed incompatible chemicals creating chlorine gas cloud. Four family members exposed including infant. | 12/21/2023 - Family rushed to ER with severe respiratory distress. Infant required pediatric ICU admission for chemical pneumonitis. | 12/23/2023 - Investigation: Technician was new hire, improperly trained. Mixed muriatic acid with chlorine shock - basic chemistry error. | 12/28/2023 - Medical status: Parents and 8-year-old recovered after oxygen treatment. 6-month-old still hospitalized with lung damage. | 01/05/2024 - Company's training records subpoenaed. No documentation of safety training for new employee. Multiple violations found. | 01/15/2024 - Legal representation: Parents retained Davis Miles McGuire Gardner. Focus on infant's potential long-term respiratory issues. | 01/25/2024 - Pediatric pulmonologist warns of possible chronic asthma, increased susceptibility to respiratory infections. | 02/10/2024 - Settlement reached: $92K with provisions for reopening if infant develops chronic conditions. Enhanced training mandated. | 02/20/2024 - All medical liens resolved. Company required to implement certified pool operator training for all technicians.",,,,,,,,,,,,,,,,,,,,,,,,,,
GL-2024-0113,Spa Injury,POL-GL-456789,2023-07-01,Client burned during laser hair removal,Bodily Injury,CA,2024-01-08,Luxe Medical Spa Beverly Hills,68000,18000,0,0,01/08/2024 - Client Stephanie Chen suffered severe burns during laser hair removal treatment on legs. Wrong settings used for skin type. | 01/09/2024 - Immediate medical attention required. Second and third-degree burns on both legs. Referred to burn specialist. | 01/12/2024 - Investigation reveals technician was not properly certified for laser operation. Falsified credentials discovered. | 01/18/2024 - Burn specialist confirms permanent scarring likely. Multiple skin graft procedures recommended. Client is model/actress. | 01/25/2024 - Attorney retained: Bloom Firm specializing in aesthetic injury cases. Career impact damages will be substantial. | 02/05/2024 - Medical costs mounting: Initial treatment $45K. Future surgeries estimated at $80K+. Career losses being calculated. | 02/15/2024 - California Medical Board investigating. Spa operating outside scope of license. Criminal charges possible. | 02/28/2024 - Quick settlement at $68K to avoid publicity. Client signed strict NDA. Spa agreed to cease laser treatments. | 03/10/2024 - Final release executed. Spa's insurance non-renewed. Regulatory actions pending.,,,,,,,,,,,,,,,,,,,,,,,,,,
GL-2024-0114,Warehouse Accident,POL-GL-678901,2024-02-01,Forklift struck visitor in warehouse,Bodily Injury,OH,2024-02-15,Midwest Distribution Center Inc,125000,28000,0,0,"02/15/2024 - Vendor representative struck by forklift while walking through warehouse. No designated pedestrian walkways marked. | 02/16/2024 - Victim: Robert Thompson, 52, sales rep. Crush injuries to right leg, compound fracture requiring multiple surgeries. | 02/18/2024 - Investigation: Forklift operator had obscured vision from overloaded pallet. No spotter used. Multiple safety violations. | 02/22/2024 - OSHA cited company for serious violations including lack of pedestrian separation and training deficiencies. | 03/01/2024 - Medical complications: Infection developed post-surgery. Amputation discussed as possibility. Victim diabetic. | 03/10/2024 - Legal counsel: Nurenberg, Paris, Heller & McCarthy. Known for workplace injury litigation. Significant demand expected. | 03/20/2024 - Amputation required below knee. Prosthetic fitting and extensive rehabilitation needed. Life care plan being developed. | 04/05/2024 - Settlement demand: $400K considering permanent disability and future medical needs. Negotiated to $125K. | 04/20/2024 - Claim resolved. Company implemented comprehensive warehouse safety program with physical barriers.",,,,,,,,,,,,,,,,,,,,,,,,,,
GL-2024-0115,Restaurant Allergy,POL-GL-890123,2023-09-01,Fatal allergic reaction despite allergy notification,Bodily Injury,NY,2024-03-10,Manhattan Bistro Group LLC,285000,76000,0,0,"03/10/2024 - Catastrophic incident: Customer died from anaphylactic shock after consuming dish containing peanuts despite clear allergy warning. | 03/11/2024 - Victim: Sarah Martinez, 34, mother of two. EpiPen administered but insufficient. Pronounced dead at hospital. | 03/13/2024 - Investigation: Server confirmed allergy notification. Kitchen used peanut oil in dish typically made without. No communication. | 03/18/2024 - Family devastated. Husband is NYPD officer. Two children ages 6 and 8. Wrongful death action anticipated. | 03/25/2024 - Attorney representation: Gair, Gair, Conason, Rubinowitz. Premier wrongful death firm. Multiple seven-figure verdicts. | 04/05/2024 - Discovery reveals pattern of allergy protocol violations. Health department found multiple violations during inspection. | 04/15/2024 - Economic loss substantial: Victim was marketing executive earning $150K annually. 30+ years of lost earnings. | 05/01/2024 - Settlement negotiations difficult. Family seeking $2M. Policy limits $1M. Personal assets of owner at risk. | 05/20/2024 - Settled at $285K from GL policy plus $215K from restaurant owner personally. Restaurant closed permanently.",,,,,,,,,,,,,,,,,,,,,,,,,,
GL-2024-0116,Gym Equipment,POL-GL-234567,2024-01-01,Cable snapped on weight machine causing injury,Bodily Injury,TX,2024-04-05,FitLife Gym Austin,76000,17000,0,0,"04/05/2024 - Cable on lat pulldown machine snapped during use. Bar struck member Jake Rodriguez in face and chest. | 04/06/2024 - Injuries documented: Broken nose, three broken ribs, severe facial lacerations requiring plastic surgery. | 04/10/2024 - Equipment inspection: Cable showed clear signs of fraying. Maintenance log falsified - no inspections in 6 months. | 04/15/2024 - Victim is personal trainer at competing gym. Facial scarring may impact his livelihood. Lost wages accumulating. | 04/22/2024 - Attorney engaged: The Carlson Law Firm. Premises liability and gross negligence claims filed. | 05/01/2024 - Other members coming forward about equipment concerns they reported that were ignored. Pattern of neglect. | 05/10/2024 - Medical bills: $58K including reconstructive surgery. Additional procedures may be needed. | 05/25/2024 - Settlement reached at $76K. Gym required to implement quarterly third-party equipment inspections. | 06/05/2024 - Claim closed. Gym's membership dropped 30% due to publicity. May not survive.",,,,,,,,,,,,,,,,,,,,,,,,,,
GL-2024-0117,School Bus Stop,POL-GL-456789,2023-11-01,Child injured at poorly designed bus stop,Bodily Injury,FL,2024-05-20,Sunshine Student Transport,145000,34000,0,0,"05/20/2024 - 7-year-old student struck by car while waiting at designated bus stop. Stop located on curve with no sidewalk. | 05/21/2024 - Child suffered traumatic brain injury, multiple fractures. Airlift to pediatric trauma center. Touch and go first 48 hours. | 05/23/2024 - Investigation: Multiple parents had complained about dangerous stop location. District took no action. | 05/28/2024 - Driver who struck child not at fault - couldn't see around curve. Full liability on district for stop placement. | 06/05/2024 - Child improving but facing long-term cognitive impacts. Special education services will be required. | 06/15/2024 - Parents retained Searcy Denney Scarola Barnhart & Shipley. Firm has history with school district negligence. | 06/25/2024 - Medical costs approaching $200K. Life care plan projects $1M+ in future care and education needs. | 07/10/2024 - School board emergency meeting. Public outrage over preventable injury. Superintendent resigned. | 07/20/2024 - Settled at $145K (policy sublimit for school transportation). District implementing comprehensive stop safety review.",,,,,,,,,,,,,,,,,,,,,,,,,,
GL-2024-0118,Retail Shooting,POL-GL-678901,2024-02-01,Active shooter in mall - inadequate security response,Bodily Injury,MI,2024-06-15,Great Lakes Shopping Center LLC,298000,89000,402000,61000,"06/15/2024 - Active shooter event at mall. Security guard fled instead of following protocol. Three shoppers shot, dozens injured in panic. | 06/16/2024 - Victims: Jennifer Walsh (paralyzed), David Kim (lost eye), Michael Brown (gunshot to shoulder). Shooter killed by police. | 06/18/2024 - Investigation: Security guard was not properly trained, failed background check that was ignored. No active shooter drills conducted. | 06/22/2024 - Prior incidents: Three violent crimes in past year. Security company recommended armed guards - mall refused due to cost. | 06/28/2024 - Mass litigation forming. Lead counsel: Fieger Law. Alleging gross negligence in security measures and training. | 07/05/2024 - Walsh's injuries catastrophic. T6 complete injury. Lifetime care costs estimated at $4M+. | 07/15/2024 - Media coverage national. Mall traffic down 60%. Multiple tenants threatening to break leases. | 07/25/2024 - Partial settlements for less severe injuries. Walsh claim will exceed primary limits. Excess carrier involved. | 08/01/2024 - Current status: $298K paid, $700K reserved. Bankruptcy being considered by mall ownership.",,,,,,,,,,,,,,,,,,,,,,,,,,
GL-2024-0119,Window Washing,POL-GL-890123,2023-08-01,Falling scaffold struck pedestrians,Bodily Injury,NY,2024-01-25,High Rise Maintenance Professionals,187000,44000,0,0,"01/25/2024 - Scaffold failure at 40-story building. Platform fell 15 floors before safety catches engaged. Debris rained on sidewalk. | 01/26/2024 - Two pedestrians struck by falling equipment. Margaret O'Brien (68) severe head trauma. Luis Garcia (35) broken shoulder. | 01/28/2024 - Investigation: Scaffold motor mount failed due to metal fatigue. No inspection records for critical components. | 02/02/2024 - O'Brien in coma for five days. Significant cognitive deficits emerging. May require lifetime care assistance. | 02/10/2024 - Building owner pointing to window washing contractor. Our insured had sole responsibility for equipment maintenance. | 02/20/2024 - Legal representation: O'Brien - Kramer, Dillof, Livingston & Moore. Garcia - Pea & Kahn. | 03/05/2024 - Department of Buildings issued stop work order. Criminal investigation for reckless endangerment initiated. | 03/25/2024 - Settlement negotiations complex due to O'Brien's ongoing deficits. Future care needs being evaluated. | 04/15/2024 - Resolved: O'Brien $145K, Garcia $42K. Company's license revoked. Criminal charges pending.",,,,,,,,,,,,,,,,,,,,,,,,,,
